{
  "report_id": "REP-0019",
  "plan_id": "EXP-0002",
  "candidate_id": "H-001",
  "execution_date": "2026-05-20",
  "trial_ids": [
    "abf2eb2c-a9be-4fa3-af4c-c9906eb8c585"
  ],
  "metrics": {
    "in_sample": {
      "sharpe": 0.327544823191964,
      "source_field": "trial_log.in_sample_sharpe",
      "window_convention": "No separate IS/OOS split convention is introduced by WP-12az / WP-S2c-17; this field records the same actual WP-12az prior-contiguous-year evaluation-window Sharpe as the out_of_sample object for schema continuity."
    },
    "out_of_sample": {
      "sharpe": 0.327544823191964,
      "source_field": "trial_log.oos_sharpe",
      "window_convention": "WP-12az / WP-S2c-17 uses the next prior contiguous equivalent-length non-cloned evaluation window, 2022-04-12 through 2023-04-11, as the second additional H-001 exp_success_criteria observation after the original full-period no-formal-split baseline. Indicators are warmed up on prior available history, but the backtest window starts flat with no pre-window position carry-in. The original H-001 REP-0002 evidence used a full-period retrospective posture, so strict non-overlap against that baseline is impossible; this package follows the later repo precedent of explicit non-cloned window disclosure for additional REP evidence.",
      "evaluation_window_start": "2022-04-12",
      "evaluation_window_end": "2023-04-11",
      "actual_bar_window_start": "2022-04-12 03:59:59.999000+00:00",
      "actual_bar_window_end": "2023-04-11 23:59:59.999000+00:00",
      "data_source": [
        "data\\processed\\binance_um_perp_BTCUSDT_4h_2020-01-01_2026-04-11_2026-04-12T1655Z.parquet",
        "data\\processed\\binance_um_perp_BTCUSDT_funding_8h_2019-09-10_2026-04-12_2026-04-12T1655Z.parquet"
      ],
      "dataset_ids": [
        "binance_um_perp_BTCUSDT_4h_2020-01-01_2026-04-11_2026-04-12T1655Z",
        "binance_um_perp_BTCUSDT_funding_8h_2019-09-10_2026-04-12_2026-04-12T1655Z"
      ],
      "config_sha256": "f97ed28a7441e1cdf203e150cc849ac706642b7fe889effd034f962b7a0fca3a",
      "dataset_sha256": "9c52bdd9b90a5c4c3f3857ee39de6941f0bd6de038007dc712616f5d6618fb87",
      "trial_count_before_append": 18,
      "trial_count_after_append": 19,
      "max_drawdown": 0.22096788227529535,
      "max_drawdown_peak": "2023-02-16 23:59:59.999000+00:00",
      "max_drawdown_trough": "2023-03-14 15:59:59.999000+00:00",
      "n_obs": 2189,
      "bars": 2190,
      "trades": 6,
      "hit_rate": 0.5,
      "profit_factor": 1.218653152446424,
      "final_equity": 10570.241255135987,
      "total_pnl": 570.2412551359866,
      "gross_pnl": 652.8999999999942,
      "fees_paid": 124.16163999999999,
      "slippage_paid": 62.080819999999996,
      "funding_paid": -103.58371513599998,
      "cost_drag_fraction": 0.12660245805483344,
      "pnl_concentration_90d": 3.2541,
      "skipped_bars": 0,
      "liquidated": false,
      "liquidation_timestamp": null,
      "sensitivity_min_ratio": -1.1554923277603262,
      "sensitivity": [
        {
          "variant": "lookback_up_25pct",
          "sharpe": -0.37847553019592695,
          "ratio_to_base": -1.1554923277603262
        },
        {
          "variant": "lookback_down_25pct",
          "sharpe": 1.0520082775196211,
          "ratio_to_base": 3.211799433334568
        },
        {
          "variant": "threshold_up_25pct",
          "sharpe": 0.5395679836483933,
          "ratio_to_base": 1.6473103692808757
        },
        {
          "variant": "threshold_down_25pct",
          "sharpe": 1.6261830407173283,
          "ratio_to_base": 4.964764898037397
        }
      ],
      "dsr": 0.0,
      "dsr_note": "P(SR>1.0)=0.0000; SR benchmark=0.5862",
      "walk_forward_efficiency": 1.0,
      "gates_passed": 3,
      "gates_total": 8,
      "side_summary": [
        {
          "direction": -1,
          "count": 3,
          "net_pnl_sum": -937.756000000003,
          "net_pnl_mean": -312.58533333333435
        },
        {
          "direction": 1,
          "count": 3,
          "net_pnl_sum": 1496.8017199999972,
          "net_pnl_mean": 498.93390666666573
        }
      ],
      "signal_counts": {
        "-1.0": 38,
        "0.0": 2125,
        "1.0": 27
      }
    }
  },
  "gate_results": [
    {
      "gate_id": "EXP-0002-G1: OOS Sharpe >= 1.0",
      "threshold": 1.0,
      "observed": 0.3275,
      "pass": false
    },
    {
      "gate_id": "EXP-0002-G2: DSR > 0.95 at 95% CI",
      "threshold": 0.95,
      "observed": "0.0; P(SR>1.0)=0.0000; SR benchmark=0.5862",
      "pass": false
    },
    {
      "gate_id": "EXP-0002-G3: Per-fold max DD <= 20%",
      "threshold": 0.2,
      "observed": 0.221,
      "pass": false
    },
    {
      "gate_id": "EXP-0002-G4: Parameter sensitivity min_ratio >= 0.70",
      "threshold": 0.7,
      "observed": "-1.1555; Computed by parameter_sensitivity() at +/-25%",
      "pass": false
    },
    {
      "gate_id": "EXP-0002-G5: Cost drag <= 50% of gross PnL",
      "threshold": 0.5,
      "observed": 0.1266,
      "pass": true
    },
    {
      "gate_id": "EXP-0002-G6: No 90-day window > 60% of PnL",
      "threshold": 0.6,
      "observed": 3.2541,
      "pass": false
    },
    {
      "gate_id": "EXP-0002-G7: <= 5 free parameters",
      "threshold": 5.0,
      "observed": 2.0,
      "pass": true
    },
    {
      "gate_id": "EXP-0002-G8: Walk-forward efficiency > 0.5",
      "threshold": 0.5,
      "observed": 1.0,
      "pass": true
    }
  ],
  "overall_verdict": "NO-GO",
  "observations": "WP-12az / WP-S2c-17 is the REP-only package for the A2C-001 first-member runway exact segment H-001 / research_oos / pre_wp_5b / exp_success_criteria. It uses existing committed EXP-0002 and creates REP-0019 only, with one appended H-001 trial-log row. It creates no new EXP scaffold or EXP plan, creates no OL or REC rows, does not increase reconciliation_count, and does not floor-cross the selected exact segment. The WP-12az window is the next prior contiguous equivalent-length non-cloned evaluation window before REP-0018, 2022-04-12 through 2023-04-11, with indicator warmup from earlier available history and no pre-window position carry-in. The prior H-001 evidence used a no-formal-split full-period retrospective baseline, so this report explicitly discloses that strict non-overlap against REP-0002 is impossible while preserving a non-cloned bounded observation window. The schema-required next_step_recommendation field carries no policy, promotion, ranking, paper/live, runtime, protected-path, or downstream authority.",
  "next_step_recommendation": "archive",
  "diagnostic_findings": [
    "REP-0019 is one genuine local research evaluation with a new trial id against existing EXP-0002; no new EXP was created.",
    "The selected downstream exact segment is H-001 / research_oos / pre_wp_5b / exp_success_criteria.",
    "The evaluation window is explicit and non-cloned: 2022-04-12 through 2023-04-11, with 2190 4h bars from 2022-04-12 03:59:59.999000+00:00 through 2023-04-11 23:59:59.999000+00:00.",
    "Indicators were warmed up on earlier available local history, and the backtest window started flat with no inherited pre-window position carry-in.",
    "The original H-001 REP-0002 evidence used a full-period no-formal-split retrospective baseline, so strict non-overlap against the existing committed H-001 evidence is impossible; this report records that limitation explicitly.",
    "The run creates no OL or REC rows, makes no REC-5 claim, and does not change H-001 exp_success_criteria reconciliation_count from 2.",
    "The next_step_recommendation field is schema-required only and has no policy, scoring, ranking/recommendation, paper/live, runtime, promotion, demotion, readiness, lifecycle, protected-path, or downstream authority.",
    "The run does not include paired-source reuse, H-005/H-006 work, Path B, EXP scaffold authoring, cohort implementation beyond this REP append, AUTO successor work, runtime behavior, or protected-path authority."
  ]
}
