{
  "report_id": "REP-0027",
  "plan_id": "EXP-0003",
  "candidate_id": "H-002",
  "execution_date": "2026-05-25",
  "trial_ids": [
    "1d4e1cf3-1556-4239-9704-090dafb4b165"
  ],
  "metrics": {
    "in_sample": {
      "sharpe": 1.2836100531356018,
      "source_field": "trial_log.in_sample_sharpe",
      "window_convention": "No separate IS/OOS split convention is introduced by WP-12dj / WP-S2c-73; this field records the same actual cycle 2 annual evaluation-window Sharpe as the out_of_sample object for schema continuity."
    },
    "out_of_sample": {
      "source_field": "trial_log.oos_sharpe",
      "window_convention": "WP-12dj / WP-S2c-73 uses the prior contiguous local data-year evaluation window, 2024-04-12 through 2025-04-11, as H-002 combined R1+R2 cycle 2 after WP-12di cycle 1 used 2025-04-12 through 2026-04-11. Indicators are warmed up on prior available 4h history, but the backtest window starts flat with no pre-window position carry-in. The original H-002 REP-0003 evidence used a full-period retrospective posture, so strict non-overlap against that baseline is impossible; this report records explicit non-cloned bounded-window disclosure for additional REP evidence.",
      "sharpe": 1.2836100531356018,
      "max_drawdown": 1.0,
      "n_obs": 2176,
      "trades": 50,
      "hit_rate": 0.34,
      "profit_factor": 0.9128514890628174,
      "final_equity": 0.0,
      "total_pnl": -10000.0,
      "gross_pnl": -5471.8771627209935,
      "fees_paid": 3021.1506000000004,
      "slippage_paid": 1510.5753000000002,
      "funding_paid": -3.603062720999869,
      "cost_drag_fraction": -0.8275264050385419,
      "dsr": 1.0,
      "walk_forward_efficiency": 1.0,
      "gates_passed": 4,
      "gates_total": 8,
      "funding_events_applied": 1094,
      "config_sha256": "3d09293e07297c941e5e829beee9b9eadfac66d20943cb2ac65f2859deeeb850",
      "dataset_sha256": "9c52bdd9b90a5c4c3f3857ee39de6941f0bd6de038007dc712616f5d6618fb87",
      "dsr_note": "P(SR>1.0)=1.0000; SR benchmark=0.6368",
      "max_drawdown_peak": "2024-11-22 07:59:59.999000+00:00",
      "max_drawdown_trough": "2025-04-09 19:59:59.999000+00:00",
      "skipped_bars": 0,
      "sensitivity_min_ratio": 0.5635580577762792,
      "short_side_trades": 25,
      "short_side_net_pnl": -9027.306642721001,
      "long_side_trades": 25,
      "long_side_net_pnl": 1310.8768200000077,
      "trial_count_before_append": 26,
      "trial_count_after_append": 27,
      "bars": 2190,
      "liquidated": true,
      "liquidation_timestamp": "2025-04-09 19:59:59.999000+00:00",
      "evaluation_window_start": "2024-04-12",
      "evaluation_window_end": "2025-04-11",
      "actual_bar_window_start": "2024-04-12 03:59:59.999000+00:00",
      "actual_bar_window_end": "2025-04-11 23:59:59.999000+00:00",
      "data_source": [
        "data\\processed\\binance_um_perp_BTCUSDT_4h_2020-01-01_2026-04-11_2026-04-12T1655Z.parquet",
        "data\\processed\\binance_um_perp_BTCUSDT_funding_8h_2019-09-10_2026-04-12_2026-04-12T1655Z.parquet"
      ],
      "dataset_ids": [
        "binance_um_perp_BTCUSDT_4h_2020-01-01_2026-04-11_2026-04-12T1655Z",
        "binance_um_perp_BTCUSDT_funding_8h_2019-09-10_2026-04-12_2026-04-12T1655Z"
      ],
      "sensitivity": [
        {
          "variant": "lookback_up_25pct",
          "lookback": 25,
          "sharpe": 0.7233887884872063,
          "ratio_to_base": 0.5635580577762792
        },
        {
          "variant": "lookback_down_25pct",
          "lookback": 15,
          "sharpe": 1.4785521880387882,
          "ratio_to_base": 1.1518702151225615
        }
      ],
      "side_summary": [
        {
          "direction": -1,
          "count": 25,
          "net_pnl_sum": -9027.306642721001,
          "net_pnl_mean": -361.09226570884005
        },
        {
          "direction": 1,
          "count": 25,
          "net_pnl_sum": 1310.8768200000077,
          "net_pnl_mean": 52.435072800000306
        }
      ],
      "signal_counts": {
        "-1.0": 1110,
        "1.0": 1080
      }
    }
  },
  "gate_results": [
    {
      "gate_id": "D2-006-G1: OOS Sharpe >= 1.0",
      "threshold": 1.0,
      "observed": 1.2836,
      "pass": true
    },
    {
      "gate_id": "D2-006-G2: DSR > 1.0 at 95% CI",
      "threshold": 1.0,
      "observed": "1.0; P(SR>1.0)=1.0000; SR benchmark=0.6368",
      "pass": true
    },
    {
      "gate_id": "D2-006-G3: Per-fold max DD <= 20%",
      "threshold": 0.2,
      "observed": 1.0,
      "pass": false
    },
    {
      "gate_id": "D2-006-G4: Parameter sensitivity min_ratio >= 0.70",
      "threshold": 0.7,
      "observed": "0.5636; Computed by parameter_sensitivity() at +/-25%",
      "pass": false
    },
    {
      "gate_id": "D2-006-G5: Cost drag <= 50% of gross PnL",
      "threshold": 0.5,
      "observed": "-0.8275; gross_pnl=-5471.88 <= 0: cost drag undefined/misleading",
      "pass": false
    },
    {
      "gate_id": "D2-006-G6: No 90-day window > 60% of PnL",
      "threshold": 0.6,
      "observed": 2.7143,
      "pass": false
    },
    {
      "gate_id": "D2-006-G7: <= 5 free parameters",
      "threshold": 5.0,
      "observed": 1.0,
      "pass": true
    },
    {
      "gate_id": "D2-006-G8: Walk-forward efficiency > 0.5",
      "threshold": 0.5,
      "observed": 1.0,
      "pass": true
    }
  ],
  "overall_verdict": "NO-GO",
  "observations": "WP-12dj / WP-S2c-73 is the H-002 combined R1+R2 cycle 2 evidence package. It uses existing committed EXP-0003 and creates REP-0027, one trial-log row, OL-0027, and two separate RECs from OL-0027 for d2_006_gates and exp_success_criteria. The WP-12dj window is the prior contiguous local data-year window, 2024-04-12 through 2025-04-11, with indicator warmup from earlier available 4h history and no pre-window position carry-in. The bounded run liquidated on 2025-04-09 19:59:59.999000+00:00, produced final_equity = 0.0, failed 4 of 8 D2-006 gates, and preserved gross-PnL-negative cost-drag as undefined/misleading rather than healthy cost behavior. The schema-required next_step_recommendation field carries no policy, promotion, ranking, paper/live, runtime, protected-path, or downstream authority.",
  "next_step_recommendation": "archive",
  "diagnostic_findings": [
    "REP-0027 is one genuine local research evaluation with a new trial id against existing EXP-0003; no new EXP was created.",
    "The selected exact segments are H-002 / research_oos / pre_wp_5b / d2_006_gates and H-002 / research_oos / pre_wp_5b / exp_success_criteria.",
    "The evaluation window is explicit and non-cloned relative to WP-12di cycle 1: 2024-04-12 through 2025-04-11, with 2190 4h bars from 2024-04-12 03:59:59.999000+00:00 through 2025-04-11 23:59:59.999000+00:00.",
    "Indicators were warmed up on earlier available local 4h history, and the backtest window started flat with no inherited pre-window position carry-in.",
    "The original H-002 REP-0003 evidence used a full-period no-formal-split retrospective baseline, so strict non-overlap against existing committed H-002 evidence is impossible; this report records that limitation explicitly.",
    "The run liquidated on 2025-04-09 19:59:59.999000+00:00, with final_equity = 0.0 and max_drawdown = 1.0 under current WP-5b bounded-equity semantics.",
    "The source REP/OL chain is intentionally reused for two separate RECs under approved R1 paired-source reuse and approved R2 batched-cycle methodology; the two RECs preserve separate expectation-source comparisons and exact-segment counts.",
    "The next_step_recommendation field is schema-required only and has no policy, scoring, ranking/recommendation, paper/live, runtime, promotion, demotion, readiness, lifecycle, protected-path, or downstream authority.",
    "The run creates no H-002 completion, A2C-002 completion, Path B, Phase 3, runtime behavior, or protected-path authority."
  ]
}
