{
  "report_id": "REP-0015",
  "plan_id": "EXP-0011",
  "candidate_id": "H-004",
  "execution_date": "2026-05-19",
  "trial_ids": [
    "a72ab3ae-9694-41b8-9d91-1a8a61830395"
  ],
  "metrics": {
    "in_sample": {
      "sharpe": 1.5655754389103171,
      "source_field": "trial_log.in_sample_sharpe",
      "window_convention": "No separate IS/OOS split convention is introduced by WP-12ag / S2b-5; this field records the same actual WP-12ag non-cloned evaluation-window Sharpe as the out_of_sample object for schema continuity."
    },
    "out_of_sample": {
      "sharpe": 1.5655754389103171,
      "source_field": "trial_log.oos_sharpe",
      "window_convention": "WP-12ag / S2b-5 uses the next prior contiguous equivalent-length evaluation window before REP-0014 / OL-0014: 2022-04-12 through 2023-04-11. Indicators are warmed up on prior available history, but the backtest window starts flat with no pre-window position carry-in. No separate IS metric convention is introduced; in_sample.sharpe records the same actual window Sharpe for schema continuity.",
      "evaluation_window_start": "2022-04-12",
      "evaluation_window_end": "2023-04-11",
      "actual_bar_window_start": "2022-04-12 23:59:59.999000+00:00",
      "actual_bar_window_end": "2023-04-11 23:59:59.999000+00:00",
      "data_source": [
        "data\\processed\\binance_um_perp_BTCUSDT_1d_2020-01-01_2026-04-11_2026-04-12T1655Z.parquet",
        "data\\processed\\binance_um_perp_BTCUSDT_funding_8h_2019-09-10_2026-04-12_2026-04-12T1655Z.parquet"
      ],
      "dataset_ids": [
        "binance_um_perp_BTCUSDT_1d_2020-01-01_2026-04-11_2026-04-12T1655Z",
        "binance_um_perp_BTCUSDT_funding_8h_2019-09-10_2026-04-12_2026-04-12T1655Z"
      ],
      "config_sha256": "8ff1bf7377ca29a8e72fe83933a20df6656fb91edd2bf5790146a41fb72634ae",
      "dataset_sha256": "47b91ceac5ae9e472a08c23390ec8a5f6fee9a627a44df11e3557fbace02813d",
      "trial_count_before_append": 14,
      "trial_count_after_append": 15,
      "max_drawdown": 0.2738105058887148,
      "max_drawdown_peak": "2022-05-27 23:59:59.999000+00:00",
      "max_drawdown_trough": "2022-05-31 23:59:59.999000+00:00",
      "n_obs": 364,
      "bars": 365,
      "trades": 6,
      "hit_rate": 0.5,
      "profit_factor": 4.2533907629366725,
      "final_equity": 26118.272672780993,
      "total_pnl": 16118.272672780993,
      "gross_pnl": 16101.100000000002,
      "fees_paid": 115.846,
      "slippage_paid": 57.923,
      "funding_paid": -190.94167278100068,
      "cost_drag_fraction": -0.001066552768506541,
      "pnl_concentration_90d": 0.580641871952972,
      "skipped_bars": 0,
      "liquidated": false,
      "liquidation_timestamp": null,
      "sensitivity_min_ratio": 0.624007092880344,
      "sensitivity": [
        {
          "variant": "fast_ma_up_25pct",
          "sharpe": 1.5655754389103171,
          "ratio_to_base": 1.0
        },
        {
          "variant": "fast_ma_down_25pct",
          "sharpe": 1.5655754389103171,
          "ratio_to_base": 1.0
        },
        {
          "variant": "slow_ma_up_25pct",
          "sharpe": 1.5655754389103171,
          "ratio_to_base": 1.0
        },
        {
          "variant": "slow_ma_down_25pct",
          "sharpe": 1.5655754389103171,
          "ratio_to_base": 1.0
        },
        {
          "variant": "rv_lookback_up_25pct",
          "sharpe": 1.4100981154566505,
          "ratio_to_base": 0.9006899829995525
        },
        {
          "variant": "rv_lookback_down_25pct",
          "sharpe": 0.9769301783192955,
          "ratio_to_base": 0.624007092880344
        },
        {
          "variant": "rv_percentile_up_25pct",
          "sharpe": 1.3130533407933915,
          "ratio_to_base": 0.8387033343518164
        },
        {
          "variant": "rv_percentile_down_25pct",
          "sharpe": 1.398902131670936,
          "ratio_to_base": 0.8935386292497088
        }
      ],
      "dsr": 1.0,
      "dsr_note": "P(SR>1.0)=1.0000; SR benchmark=0.5497",
      "walk_forward_efficiency": 1.0,
      "gates_passed": 6,
      "gates_total": 8,
      "side_summary": [
        {
          "direction": -1,
          "count": 5,
          "net_pnl_sum": 6515.6481200000035,
          "net_pnl_mean": 1303.1296240000006
        },
        {
          "direction": 1,
          "count": 1,
          "net_pnl_sum": -329.95953999999784,
          "net_pnl_mean": -329.95953999999784
        }
      ]
    }
  },
  "gate_results": [
    {
      "gate_id": "D2-006-G1: OOS Sharpe >= 1.0",
      "threshold": 1.0,
      "observed": 1.5656,
      "pass": true
    },
    {
      "gate_id": "D2-006-G2: DSR > 1.0 at 95% CI",
      "threshold": 1.0,
      "observed": "1.0; P(SR>1.0)=1.0000; SR benchmark=0.5497",
      "pass": true
    },
    {
      "gate_id": "D2-006-G3: Per-fold max DD <= 20%",
      "threshold": 0.2,
      "observed": 0.2738,
      "pass": false
    },
    {
      "gate_id": "D2-006-G4: Parameter sensitivity min_ratio >= 0.70",
      "threshold": 0.7,
      "observed": "0.6240; Computed by parameter_sensitivity() at \\u00b125%",
      "pass": false
    },
    {
      "gate_id": "D2-006-G5: Cost drag <= 50% of gross PnL",
      "threshold": 0.5,
      "observed": -0.0011,
      "pass": true
    },
    {
      "gate_id": "D2-006-G6: No 90-day window > 60% of PnL",
      "threshold": 0.6,
      "observed": 0.5806,
      "pass": true
    },
    {
      "gate_id": "D2-006-G7: <= 5 free parameters",
      "threshold": 5.0,
      "observed": 4.0,
      "pass": true
    },
    {
      "gate_id": "D2-006-G8: Walk-forward efficiency > 0.5",
      "threshold": 0.5,
      "observed": 1.0,
      "pass": true
    }
  ],
  "overall_verdict": "NO-GO",
  "observations": "WP-12ag / S2b-5 is the REP-only package for the selected A1 exact segment H-004 / research_oos / post_wp_5b / exp_success_criteria. It uses existing committed EXP-0011 and creates REP-0015 only, with one appended trial-log row. It creates no new EXP scaffold or EXP plan, creates no OL or REC rows, and does not itself move the selected exact segment from reconciliation_count = 2 to 3; later separately scoped OL and REC packages would be required. The WP-12ag window is the next prior contiguous equivalent-length non-cloned evaluation window before REP-0014, 2022-04-12 through 2023-04-11, subject to and supported by actual local data. It is distinct from REP-0011 full-period evidence, REP-0012 final-local-data-year evidence, REP-0013 next-most-recent evidence, and REP-0014 prior-window evidence. The schema-required next_step_recommendation field carries no policy, promotion, ranking, paper/live, runtime, protected-path, or downstream authority.",
  "next_step_recommendation": "archive",
  "diagnostic_findings": [
    "REP-0015 is one genuine local research evaluation with a new trial id against existing EXP-0011; no new EXP was created.",
    "The selected exact segment is H-004 / research_oos / post_wp_5b / exp_success_criteria.",
    "The evaluation window is explicit and non-cloned: 2022-04-12 through 2023-04-11, with 365 daily bars from 2022-04-12 23:59:59.999000+00:00 through 2023-04-11 23:59:59.999000+00:00.",
    "Indicators were warmed up on earlier available local history, and the backtest window started flat with no inherited pre-window position carry-in.",
    "The run creates no OL or REC rows and makes no REC-5 claim; the selected exp_success_criteria segment remains below target until later OL and REC packages are separately committed and validated.",
    "The next_step_recommendation field is schema-required only and has no policy, scoring, ranking/recommendation, paper/live, runtime, promotion, demotion, readiness, lifecycle, protected-path, or downstream authority.",
    "The run makes no H-004 pre/post comparison claim and does not combine expectation sources or pipeline versions.",
    "The run does not include Path B, cohort creation, H-011, H-012+, A2 implementation, AUTO successor work, runtime behavior, or protected-path authority."
  ]
}
